Text,Name,Created At,Tweet Type,,,
"Thank you to all of our incredible supporters, volunteers, and staff in New Hampshire! Your hard work and faith in our campaign mean the world to me. Now, we’re headed to Nevada, South Carolina, and beyond.",Joe Biden,Wed Feb 12 03:10:00 +0000 2020,Tweet,,,
Joe's about to take the stage from South Carolina. Tune in to watch live: https://t.co/aGEAMOrBSq,Joe Biden,Wed Feb 12 02:21:47 +0000 2020,Tweet,,,
"President Mandela was no ordinary man. When he stepped out of prison 30 years ago today, he immediately resumed his life's work to end apartheid. He showed us that trust and reconciliation are possible, delivering justice for his people.",Joe Biden,Tue Feb 11 23:20:00 +0000 2020,Tweet,,,
"There has been a lot of veiled criticism of the Obama-Biden record lately, so let me be clear about something: Barack Obama was a great president. We don’t say that enough. https://t.co/a5R0hMxOMX",Joe Biden,Tue Feb 11 22:05:00 +0000 2020,Tweet,,,
"Thank you for standing with me, @IBEW. I'll fight alongside you every single day in the White House to strengthen America's unions and rebuild the middle class. https://t.co/tdbAgzVdHS",Joe Biden,Tue Feb 11 21:39:27 +0000 2020,Tweet,,,
Today’s the day — it’s primary day in New Hampshire!  Head to https://t.co/37BiAB9xTK to make calls into the Granite State from wherever you are in the country to help get voters to the polls.,Joe Biden,Tue Feb 11 20:45:00 +0000 2020,Tweet,,,
"We are in a battle for the soul of this nation. If we want to win, it’s going to take everyone stepping up and making their voice heard. If you live in New Hampshire, confirm your polling place by heading to https://t.co/M2XhjJUMST and make sure to get out and vote today. https://t.co/yNCBuNKlmh",Joe Biden,Tue Feb 11 18:40:00 +0000 2020,Tweet,,,
"It's primary day in New Hampshire — and we're counting on supporters across the Granite State to get out and vote. Head to https://t.co/M2XhjJUMST to confirm your polling location. Together, we can win this primary, beat Donald Trump, and restore the soul of this nation. https://t.co/HFYWSAw5Cn",Joe Biden,Tue Feb 11 15:30:00 +0000 2020,Tweet,,,
"Today’s the day, New Hampshire! Confirm your polling location at https://t.co/M2XhjJUMST and make sure to get out and vote. https://t.co/7BqdYrqFsK",Joe Biden,Tue Feb 11 12:02:00 +0000 2020,Tweet,,,
RT @DrBiden : You can take the girl out of Philly... https://t.co/tiAbSEnH14,Joe Biden,Tue Feb 11 03:26:49 +0000 2020,Retweet,,,
"Donald Trump is proposing cuts to Medicaid, Obamacare, and food assistance — while protecting giant tax giveaways to corporations and the super-wealthy. He has once again proved how morally unfit he is to lead our country. https://t.co/bwNi6knzuU",Joe Biden,Tue Feb 11 02:41:15 +0000 2020,Tweet,,,
"Donald Trump will say over and over that the economy is on the ballot this year. It is. But America’s character is on the ballot too. And despite what Trump says, we don’t have to choose one or the other.

We can be a good country with a good economy. https://t.co/VKxpWqMeHg",Joe Biden,Tue Feb 11 01:30:00 +0000 2020,Tweet,,,
"The New Hampshire primary is just one day away, and we need your help to talk with folks about what’s at stake in this election. Head to https://t.co/37BiAB9xTK to make calls into New Hampshire from wherever you are in the country.",Joe Biden,Tue Feb 11 00:30:00 +0000 2020,Tweet,,,
I've always said you shouldn't let the barriers in life define you. Brayden sure as hell didn't let them define him. I'm proud to be a part of his story: https://t.co/2udsXfsCfy,Joe Biden,Tue Feb 11 00:01:00 +0000 2020,Tweet,,,
"RT @JoeForNH : NH: primary day is tomorrow!

Your vote is critical to electing the candidate who will beat Donald Trump, help Democrats win up and down the ballot, and restore the soul of this nation. 

The choice is clear: vote @JoeBiden. #NHPolitics https://t.co/bW6Uj0kyhB",Joe Biden,Mon Feb 10 23:11:59 +0000 2020,Retweet,,,
"With just one day until the New Hampshire primary, we’re hard at work making our final case to voters — and we need your help. Chip in today to help us deliver our closing argument to as many Granite Staters as possible: https://t.co/hWl9p6lqQ4",Joe Biden,Mon Feb 10 21:40:00 +0000 2020,Tweet,,,
We need a president with the courage to stand up to the @NRA and pass common-sense gun safety measures — not one with a long record of siding with the gun lobby. https://t.co/q4ttyVjdVt,Joe Biden,Mon Feb 10 19:20:00 +0000 2020,Tweet,,,
Experience matters. The White House is no place for on-the-job training. We need a president who will be prepared to clean up Donald Trump’s mess on day one.,Joe Biden,Mon Feb 10 17:45:00 +0000 2020,Tweet,,,
"I've lost a lot in my life, but I'll be damned if I'm going to stand by and lose my country too. We have to beat Donald Trump.",Joe Biden,Mon Feb 10 01:20:00 +0000 2020,Tweet,,,
"I know there are a lot of folks who want to write our campaign off already — but I’ve got news for them: We’re not going anywhere. There's too much at stake in this election.

I will fight for every last vote, but I can't do it without you. Chip in today: https://t.co/hTbAPI8Nkq",Joe Biden,Mon Feb 10 00:58:00 +0000 2020,Tweet,,,
"There are just two days until the first-in-the-nation primary, and we need your help to bring us across the finish line. If you have a few minutes, head to https://t.co/66UCpVP0jc to talk with New Hampshire voters about what's at stake in this election. I’d greatly appreciate it. https://t.co/bLSiQfDehY",Joe Biden,Sun Feb 09 23:08:11 +0000 2020,Tweet,,,
"It’s not enough to just end Citizens United — we have to eliminate all private dollars from our federal elections.

It's time we return our democracy to the people.",Joe Biden,Sun Feb 09 22:16:30 +0000 2020,Tweet,,,
We are in a climate emergency. We have to get Donald Trump out of the White House and treat climate change like the existential threat that it is — before it's too late. https://t.co/449eZamU9S,Joe Biden,Sun Feb 09 19:38:49 +0000 2020,Tweet,,,
Rebuilding the middle class and ensuring that this time everyone comes along starts with one word: unions. That’s why I look forward to signing the #PROAct as President. Congratulations to the House and labor movement for passing this landmark bill.,Joe Biden,Sun Feb 09 18:30:00 +0000 2020,Tweet,,,
#TeamJoe has been hard at work talking with folks in every corner of New Hampshire — but it all comes down to this final push. Every conversation will make a big difference on Tuesday. Sign up to volunteer today: https://t.co/8qV24014Y7,Joe Biden,Sun Feb 09 17:32:00 +0000 2020,Tweet,,,
"When it comes to expanding access to more affordable health care, Americans like Charlene can't wait. I'm the only candidate in this race who has passed a big, bold health care reform bill — and I'll do it again in the White House. https://t.co/7uq8qftn0V",Joe Biden,Sat Feb 08 23:15:00 +0000 2020,Tweet,,,
Donald Trump does not deserve to be commander in chief for one more day. https://t.co/nksx4dBBh3,Joe Biden,Sat Feb 08 20:10:00 +0000 2020,Tweet,,,
Former Mayor Pete doesn’t think very highly of the Obama-Biden record. Let’s compare. https://t.co/132TB7MHaq,Joe Biden,Sat Feb 08 17:03:13 +0000 2020,Tweet,,,
"I just wrapped up tonight's #DemDebate, and I need your help to keep this momentum going. Every donation makes a big difference. Chip in today: https://t.co/mKh1hKqzJr https://t.co/op9BaD4RYE",Joe Biden,Sat Feb 08 04:35:00 +0000 2020,Tweet,,,
Lt. Col. Vindman is an American patriot. #DemDebate https://t.co/ZOU4SDKTEe,Joe Biden,Sat Feb 08 03:45:00 +0000 2020,Tweet,,,
"With just four days until New Hampshire voters head to the polls, there’s no time to waste. We need your help to keep the momentum going from tonight’s #DemDebate. Chip in $5 to help power our campaign through this crucial stretch: https://t.co/GAlB0S4lQ6",Joe Biden,Sat Feb 08 03:31:41 +0000 2020,Tweet,,,
"RT @TeamJoe : While @JoeBiden was fighting to end gun violence and voting to hold gun manufacturers accountable, @BernieSanders was voting to protect them. 

It’s clear — @JoeBiden’s record of taking on the gun lobby is stronger than any candidate on the #DemDebate stage. https://t.co/JjNta3scoQ",Joe Biden,Sat Feb 08 02:33:20 +0000 2020,Retweet,,,
"Five.

That’s how many times Senator Sanders voted against the Brady background check bill that has kept 3 million firearms out of dangerous hands.

I helped pass it.

We need a president who'll stand up to the @NRA — not stand with them against lifesaving gun safety measures.",Joe Biden,Sat Feb 08 02:30:11 +0000 2020,Tweet,,,
"The United States must keep our commitments when we make them, otherwise we have no power to lead the world. The only way to not become the police of the world is to have allies that will join us in dealing with failed states and terrorism. #DemDebate",Joe Biden,Sat Feb 08 02:19:37 +0000 2020,Tweet,,,
The best path forward on health care is to protect and build on Obamacare — not tear it down and start over. #DemDebate https://t.co/xXoYjc2BOb,Joe Biden,Sat Feb 08 02:11:27 +0000 2020,Tweet,,,
"As President, I will use military power responsibly and as a last resort. We will not go back to forever wars in the Middle East. #DemDebate",Joe Biden,Sat Feb 08 02:04:30 +0000 2020,Tweet,,,
"Donald Trump called our troops’ traumatic brain injuries “headaches.” 

If my son had still been there in Iraq, I’d have been so damn angry. 

Donald Trump does not deserve to be commander in chief for one more day. #DemDebate",Joe Biden,Sat Feb 08 01:56:48 +0000 2020,Tweet,,,
Donald Trump should have been pinning a medal on Lt. Col. Vindman — not Rush Limbaugh. #DemDebate,Joe Biden,Sat Feb 08 01:45:31 +0000 2020,Tweet,,,
"I led the Obama-Biden Administration’s efforts to pass and implement the Recovery Act, which saved the American economy from another depression and sent South Bend, IN, over $75 million to invest in projects around the town.

Projects that Mayor Pete likes to take credit for. https://t.co/FQOusAA3Ac",Joe Biden,Sat Feb 08 01:28:11 +0000 2020,Tweet,,,
"One of the most important issues we face as a nation is ensuring affordable, accessible health care. There's work to do, but that doesn't mean starting from scratch. It means protecting and building on Obamacare. #DemDebate https://t.co/7J4nC6ZUGX",Joe Biden,Sat Feb 08 01:25:46 +0000 2020,Tweet,,,
We have to get real about health care. The American people deserve the truth and an explanation of what Medicare for All will cost — not political games. #DemDebate https://t.co/V6wZViZoXA,Joe Biden,Sat Feb 08 01:21:14 +0000 2020,Tweet,,,
We’re not only going to have to win the White House but we have to bring along the United States Senate. We can’t do that with someone who labels themselves as a Democratic Socialist. #DemDebate,Joe Biden,Sat Feb 08 01:10:35 +0000 2020,Tweet,,,
I’m incredibly proud of Brayden for sharing his story on national TV. He is truly a remarkable young man — and I can’t wait to see what his future holds. https://t.co/nN9ZFIAJ0W,Joe Biden,Sat Feb 08 00:25:58 +0000 2020,Tweet,,,
No corporation pulling in billions of dollars in profits should pay a lower tax rate than our teachers and firefighters. It’s time corporations pay their fair share. https://t.co/L1NtDsSxIn,Joe Biden,Fri Feb 07 22:57:46 +0000 2020,Tweet,,,
"Who in God's name needs a weapon that can hold one hundred rounds? These weapons of war have no place in our communities. I’ve taken on the @NRA to ban them once before, and I’ll do it again in the White House. https://t.co/JPFMzM1kcB",Joe Biden,Fri Feb 07 20:45:00 +0000 2020,Tweet,,,
"We're just four days from the first-in-the-nation primary in New Hampshire, and we need all hands on deck to talk with voters before they head to the polls. Head to https://t.co/37BiABr9ik to make calls to New Hampshire voters from wherever you are in the country.",Joe Biden,Fri Feb 07 18:50:00 +0000 2020,Tweet,,,
"When I met Brayden this week, he had a familiar anxiety on his face. It was the anxiety of a kid with a stutter, something I struggled to overcome when I was a kid too. Here's what I told him. https://t.co/IIF386n2GU",Joe Biden,Fri Feb 07 17:01:14 +0000 2020,Tweet,,,
We need a president who chooses compassion over cruelty.,Joe Biden,Fri Feb 07 01:47:34 +0000 2020,Tweet,,,
It’s not hyperbole to say that we are in a battle for the soul of this nation. Everything that makes us who we are is at stake. We have to get Donald Trump out of the White House and take back this country.,Joe Biden,Fri Feb 07 00:15:00 +0000 2020,Tweet,,,
Empathy matters. Compassion matters. We have to reach out to one another and heal this country — and that’s what I’ll do as president. https://t.co/XVDnUc32Ij,Joe Biden,Thu Feb 06 22:01:00 +0000 2020,Tweet,,,
"John DiEleuterio had a huge heart and was a friend I counted on for over 50 years. As a Colonel in the National Guard and as the State Director in my Senate office, John served our country with dignity and distinction. Jill and I send our condolences to Maureen and his family.",Joe Biden,Thu Feb 06 20:46:38 +0000 2020,Tweet,,,
"I firmly believe America's best days still lie ahead. If we come together and unite this country, there's not a single thing we can't do.",Joe Biden,Thu Feb 06 18:45:00 +0000 2020,Tweet,,,
Grace - I've said it before and I'll say it again: LGBTQ rights are civil rights. It's an honor to work for you and in service of justice for every American in this country. https://t.co/8eegCp3ffS,Joe Biden,Thu Feb 06 16:47:10 +0000 2020,Tweet,,,
"Let's be real about health care. You gotta level with the American people. Tell them the truth, what you think it's gonna cost and how you're gonna get it done. https://t.co/37aeT57Thz",Joe Biden,Thu Feb 06 04:38:02 +0000 2020,Tweet,,,
"I grew up with a stutter. At tonight’s @CNN town hall, I was asked what advice I would give to those working to overcome their own — here’s what I said: https://t.co/M0obXY0s6d",Joe Biden,Thu Feb 06 03:34:27 +0000 2020,Tweet,,,
"Today, @DougJones stood up and did the right thing. He showed courage on the Senate floor, when many did not. 

The only way we will defeat Trump now is to keep strong Democrats in the Senate—and a strong campaign at the top of the ticket. Chip in today: https://t.co/ekhjoBDayi",Joe Biden,Thu Feb 06 02:29:29 +0000 2020,Tweet,,,
Looking forward to discussing what’s at stake in this election and my bold vision for the future of our country at tonight’s town hall in New Hampshire. Tune in to @CNN at 8 PM ET to watch live.,Joe Biden,Thu Feb 06 00:45:00 +0000 2020,Tweet,,,
Only Donald Trump could debase our nation's highest civilian honor and turn it into a partisan political prop. https://t.co/HGFUaaOl1G,Joe Biden,Wed Feb 05 23:54:01 +0000 2020,Tweet,,,
"My North Star as president will be rebuilding the middle class. And this time, we're going to bring everyone along regardless of race, gender, religion, ethnicity, sexual orientation, or disability. https://t.co/TyiYGD8D0y",Joe Biden,Wed Feb 05 22:01:00 +0000 2020,Tweet,,,
"Fred, it must not have been easy to sit there and listen to @realdonaldtrump lie. I’m proud of you for speaking truth to the abuse of power. https://t.co/xrnSAKC8QZ",Joe Biden,Wed Feb 05 20:20:03 +0000 2020,Tweet,,,
"Mayor Pete likes to call me part of the old failed Washington. Was it a failure when I helped pass Obamacare, the Paris Agreement, the Violence Against Women Act, or the assault weapons ban?

I have a stronger record of passing big, progressive legislation than anyone running.",Joe Biden,Wed Feb 05 17:40:00 +0000 2020,Tweet,,,
"Last night, President Trump turned his constitutional obligation to inform Congress about the state of our union into an episode of reality television. It was a shameful display. #SOTU",Joe Biden,Wed Feb 05 16:26:00 +0000 2020,Tweet,,,
"Our administration brought the economy back from the brink of depression, saved the auto industry, and made health care available to millions of families.

Donald Trump gave billionaires a tax break. https://t.co/jBe34MIhtp",Joe Biden,Wed Feb 05 03:08:58 +0000 2020,Tweet,,,
"Rosa Parks helped ignite a movement that changed the course of history. Let’s carry on her legacy by continuing to push our nation to finally live up to our highest ideals. We can’t rest until we achieve liberty, justice, and equality for all. #RosaParksDay",Joe Biden,Wed Feb 05 00:15:00 +0000 2020,Tweet,,,
"Caroline has served her country with the utmost distinction both at home and abroad. I'm honored to have her support as we head into New Hampshire, Nevada, and South Carolina. https://t.co/xf153Dhfwm",Joe Biden,Tue Feb 04 23:15:05 +0000 2020,Tweet,,,
The fight against cancer is personal for me — like it is for so many people. And it's a fight we must win. With the incredible breakthroughs we've made in recent years — and with so many just over the horizon — I'm confident that we will end cancer as we know it. #WorldCancerDay,Joe Biden,Tue Feb 04 21:30:00 +0000 2020,Tweet,,,
".@ATUcomm has been integral to the labor movement and putting our country on a path towards lifting the middle class. We've got a long campaign ahead of us, and I'm thrilled to have the support of my friend John Costa and the hard-working members of ATU with me. https://t.co/VUVwL172Md",Joe Biden,Tue Feb 04 16:43:37 +0000 2020,Tweet,,,
RT @schultzohio : Tonight was a great night for us. We are thrilled with our performance across the state. We believe we will emerge with the delegates we need to continue on our path to make Joe Biden the Democratic nominee. https://t.co/xiHrYsRfmF,Joe Biden,Tue Feb 04 15:22:53 +0000 2020,Retweet,,,
"Iowa was just the first step. Now, we’re taking this campaign to the rest of the country, and we need your help to do it. I know we’ve asked a lot these last nine months, but there's never been a more crucial time for our campaign. Chip in today: https://t.co/sb6EUIcnyx",Joe Biden,Tue Feb 04 05:45:00 +0000 2020,Tweet,,,
"Everybody knows who Donald Trump is — it’s time we show them who we are. We choose: 

Hope over fear. 
Science over fiction. 
Unity over division.
Compassion over cruelty. 
Truth over lies.",Joe Biden,Tue Feb 04 05:33:00 +0000 2020,Tweet,,,
We need a president who is not only ready to fight but is also ready to heal this country — and that’s exactly what I’ll do as president. There’s nothing we’ve been unable to do when we do it together.,Joe Biden,Tue Feb 04 05:27:00 +0000 2020,Tweet,,,
"I want to thank our incredible supporters and volunteers in Iowa — and all across the country. Now, it’s onto New Hampshire, Nevada, South Carolina, and beyond! https://t.co/PRwO2rieJ4",Joe Biden,Tue Feb 04 04:55:01 +0000 2020,Tweet,,,
"Joe's about to take the stage in Des Moines, Iowa. Tune in to watch live: https://t.co/x7RDw4dS17",Joe Biden,Tue Feb 04 04:30:59 +0000 2020,Tweet,,,
"Iowa — if you’re in line at your caucus location by 7 PM CT, you can caucus! https://t.co/oQ2918WP95",Joe Biden,Tue Feb 04 00:30:00 +0000 2020,Tweet,,,
"America's character is on the ballot. I don't believe we're the dark, angry nation we see in Donald Trump's tweets — we are so much better than who he thinks we are.",Joe Biden,Mon Feb 03 23:40:00 +0000 2020,Tweet,,,
"Imagine all the progress we can make in the next four years. With Donald Trump out of the way, we can make affordable health care a right, lead the fight on climate change, and ban assault weapons.

It's all possible. And it starts tonight in Iowa. https://t.co/Zf0Z0q6Sp1",Joe Biden,Mon Feb 03 22:45:00 +0000 2020,Tweet,,,
"In a few hours, Iowans will gather around the state to set our nation on the path to picking the next president. It’s a big responsibility—and we need everyone on #TeamJoe to show up and make their voices heard. Head to https://t.co/3HaA5wLv2M to confirm your caucus location. https://t.co/lHozVyO6i9",Joe Biden,Mon Feb 03 21:55:00 +0000 2020,Tweet,,,
"The next president will inherit a country divided — and a world in disarray. There will be no time for on-the-job training.

We need a president who is ready on day one.",Joe Biden,Mon Feb 03 20:50:00 +0000 2020,Tweet,,,
The stakes of this election could not be higher. We only have one chance to beat Donald Trump — and we need a nominee who can get the job done. https://t.co/N1yrARZHvc,Joe Biden,Mon Feb 03 19:30:00 +0000 2020,Tweet,,,
"Caucus Day is here, Iowa! Head to https://t.co/3HaA5wLv2M to confirm your caucus location and plan to show up by 6:30 PM CT. I hope I can count on your support — because together we can beat Donald Trump, unite this country, and win the battle for the soul of this nation. https://t.co/ZM0aET6rW7",Joe Biden,Mon Feb 03 17:30:00 +0000 2020,Tweet,,,
"It’s caucus day in Iowa, and we need your help to bring us across the finish line. If you have a few extra minutes, head to https://t.co/0OADrrjdo9 to make calls into Iowa. I’d greatly appreciate it. Let’s finish strong. https://t.co/rA1MXti3L2",Joe Biden,Mon Feb 03 16:01:00 +0000 2020,Tweet,,,
"We choose:

Hope over fear.
Unity over division. 
Truth over lies. 

Our nation’s character is on the ballot, Iowa. Tonight, let’s show them who we really are. https://t.co/GU5pUGcCHE",Joe Biden,Mon Feb 03 13:30:00 +0000 2020,Tweet,,,
"Today’s the day, Iowa! Confirm your caucus location at https://t.co/3HaA5wLv2M and make a plan to arrive by 6:30 PM CT. https://t.co/vmzNwW1Kro",Joe Biden,Mon Feb 03 12:25:00 +0000 2020,Tweet,,,
"We can beat Donald Trump.
We can unite this country.
We can restore the soul of this nation.

It all begins tomorrow night in Iowa. https://t.co/Lhj8CSmOZG",Joe Biden,Mon Feb 03 01:10:00 +0000 2020,Tweet,,,
"When we launched this campaign, I said we were in a battle for the soul of this nation. That battle begins tomorrow night in Iowa—and requires everyone stepping up and making their voice heard. If you’re with me, let me know by committing to caucus today: https://t.co/OFXDjKF5uI",Joe Biden,Mon Feb 03 00:05:00 +0000 2020,Tweet,,,
"My values are rooted in the American character: tough, resilient, but always full of hope. We need a president who appeals to the best in us and unites this nation — because if we come together, there’s not a single thing we can’t do. https://t.co/t8qkivIL48",Joe Biden,Sun Feb 02 23:20:00 +0000 2020,Tweet,,,
This is the final stretch — the Iowa caucuses are just one day away and we need your help to keep the momentum going. Every phone call and every conversation will make a big difference tomorrow night. Head to https://t.co/0OADrrAOfH to make calls into Iowa. Let’s get to work. https://t.co/ZNUfpBg2B8,Joe Biden,Sun Feb 02 22:15:00 +0000 2020,Tweet,,,
"When I say we need to restore the soul of the nation, I’m not talking about taking us back to an America that never existed—but propelling us forward to a place we’ve never been. Where we finally live up to our highest ideals and everyone gets a full share of the American dream.",Joe Biden,Sun Feb 02 20:45:00 +0000 2020,Tweet,,,
I’ve never been more optimistic about the future of America. There’s not a single thing we can’t do if we do it together. https://t.co/u4ZVMv31P0,Joe Biden,Sun Feb 02 19:20:00 +0000 2020,Tweet,,,
"RT @JoeForIA : This is the final stretch. Everything we have done, worked towards, and fought for comes down to Monday night. 

Help put us over the edge by signing up to volunteer this weekend. Your extra shift could be what helps @JoeBiden win the #IACaucus. 

https://t.co/zj1chl5XUG https://t.co/9g2UbdOPmN",Joe Biden,Sun Feb 02 18:33:21 +0000 2020,Retweet,,,
"#TeamJoe has been hard at work making phone calls, knocking doors, and talking with as many folks as possible over the last nine months—but it all comes down to these last few days. We need all hands on deck for this final push. Sign up to volunteer today: https://t.co/mwJBZkb34x https://t.co/OP2UVH0zaD",Joe Biden,Sun Feb 02 17:55:00 +0000 2020,Tweet,,,
"The Iowa caucus is tomorrow night, it’s time to make your plan! Caucusing is fun and easy — and making a plan only takes a few minutes. Head to https://t.co/OezAqUfIOF to make sure you’re all set. https://t.co/gzExf4lb0v",Joe Biden,Sun Feb 02 16:23:00 +0000 2020,Tweet,,,
"Trump further diminished the U.S. in the eyes of the world by expanding his travel ban. This new “African Ban,” is designed to make it harder for black and brown people to immigrate to the United States. It’s a disgrace, and we cannot let him succeed. https://t.co/oePD5eSAWY",Joe Biden,Sun Feb 02 03:16:04 +0000 2020,Tweet,,,
"America was founded on the ideals of equality, equity, and fairness—we've never fully lived up to them, but we've never stopped trying. During #BlackHistoryMonth and all year-round, let's celebrate the rich history and culture that's always been vital to the fabric of America. https://t.co/FNYM1O6CMm",Joe Biden,Sun Feb 02 01:05:55 +0000 2020,Tweet,,,
"Health care is on the ballot. We need to protect Obamacare from Donald Trump’s relentless attempts to repeal and sabotage it — and build on the law to ensure every American has the peace of mind that comes with quality, affordable care. https://t.co/KlbtBOASNU",Joe Biden,Sat Feb 01 23:20:00 +0000 2020,Tweet,,,
"We are in the midst of a crisis with the coronavirus. We need to lead the way with science — not Donald Trump’s record of hysteria, xenophobia, and fear-mongering. He is the worst possible person to lead our country through a global health emergency.",Joe Biden,Sat Feb 01 22:01:00 +0000 2020,Tweet,,,
