Text,Name,Created At,Tweet Type,,,
"The super-wealthy don’t need another tax cut. Period.

My administration will repeal the Trump tax cuts for the super-wealthy and reward work, not just wealth. https://t.co/jeNEA1TUjW",Joe Biden,Thu Oct 31 14:00:01 +0000 2019,Tweet,,,
"Donald Trump's erratic foreign policy has abandoned our allies, abdicated our leadership, and tarnished our reputation. It has to stop.

In a Biden administration, America will once again lead by example and rally the world to meet our common challenges. https://t.co/qPHYk6SaDF",Joe Biden,Wed Oct 30 23:10:00 +0000 2019,Tweet,,,
Our planet cannot afford four more years of Donald Trump in the White House. https://t.co/r1e2ycnPfT,Joe Biden,Wed Oct 30 22:08:59 +0000 2019,Tweet,,,
"I’m not afraid to say the word union. America’s unions built the middle class — and in a Biden administration, we’ll work alongside them to rebuild it. https://t.co/VZnCFtAEEB",Joe Biden,Wed Oct 30 20:27:00 +0000 2019,Tweet,,,
"We are at a crucial moment. We can survive four years of Donald Trump, but if we give him eight years in the White House, he will forever alter the character of our nation. We cannot let that happen.

Chip in to help us make Trump a one-term president: https://t.co/swNOgJE8EM",Joe Biden,Wed Oct 30 19:52:00 +0000 2019,Tweet,,,
"Lt. Col. Alexander S. Vindman’s testimony made clear what we already knew: Donald Trump pressured Ukraine to interfere in our elections on his behalf and the White House tried to cover it up.

We cannot let Trump get away with this abuse of power. He must be impeached. https://t.co/xiPCorMtsJ",Joe Biden,Wed Oct 30 18:44:14 +0000 2019,Tweet,,,
"President Trump’s reckless trade war is hurting farmers like Kevin—enough is enough.

Our farmers can't afford four more years of a leader who delivers nothing but empty promises. As president, I’ll stand up to China and pursue a trade policy that prioritizes American workers. https://t.co/4BvAhlRVoy",Joe Biden,Wed Oct 30 16:01:00 +0000 2019,Tweet,,,
"Proud to stand in solidarity with @TWULocal100 and @Transportworker in their fight for a fair contract. The 40,000+ bus and subway workers who move New York deserve the dignity that comes with fair wages, good benefits, and job security. #TWUrally2019",Joe Biden,Wed Oct 30 15:20:00 +0000 2019,Tweet,,,
I’ve seen firsthand how hard educators work with little pay and few resources. We must do better. A Biden administration will ensure our educators finally receive the pay and dignity they deserve. https://t.co/lvtfAz1xIE,Joe Biden,Wed Oct 30 14:06:00 +0000 2019,Tweet,,,
"With Trump, it’s always all about him. It's all about beating his chest about what he's done, the stable genius that he is. We need a real leader. https://t.co/lOSBBQIuuh",Joe Biden,Wed Oct 30 01:57:03 +0000 2019,Tweet,,,
"After almost three years on the job, Donald Trump is still unprepared to lead the world and unfit to lead our country. To clean up his mess, we need a leader who doesn't require on the job training. I'm prepared to get to work on day one. https://t.co/k8D0gRVzP1",Joe Biden,Wed Oct 30 00:45:00 +0000 2019,Tweet,,,
"Every day that Donald Trump sits in the Oval Office is a dangerous day for the United States. His erratic, impulsive decisions threaten our standing in the world and make us all less safe. https://t.co/8FqfCPE7Rv",Joe Biden,Wed Oct 30 00:25:00 +0000 2019,Tweet,,,
"Some Americans celebrate #NationalCatDay, some celebrate #NationalDogDay — President Trump celebrates neither. It says a lot.

It’s time we put a pet back in the White House. https://t.co/6za6FUocfh",Joe Biden,Tue Oct 29 23:45:00 +0000 2019,Tweet,,,
"For too long, corporations have stifled workers’ right to organize and collectively bargain for the pay and benefits they deserve.

That ends with a Biden administration.

We will hold corporations and executives personally accountable for interfering with the rights of workers.",Joe Biden,Tue Oct 29 22:55:00 +0000 2019,Tweet,,,
"Seven years ago, Hurricane Sandy devastated the East Coast. As we remember those we lost, we must renew our commitment to addressing climate change. Extreme storms will only become more frequent and powerful if we don’t take urgent action to tackle this crisis. https://t.co/9TK6aBdoyx",Joe Biden,Tue Oct 29 22:05:00 +0000 2019,Tweet,,,
"I welcome the House’s passage of H Res 296, which recognizes and condemns the Armenian Genocide of 1915-23. By acknowledging this genocide we honor the memory of its victims and vow: never again.",Joe Biden,Tue Oct 29 21:33:00 +0000 2019,Tweet,,,
"Filipino-American History Month is an important opportunity to honor the rich history of the Filipino-American community, including the legacy of brave Filipino veterans who fought in World War II, and all the ways they strengthen our nation.",Joe Biden,Tue Oct 29 20:15:00 +0000 2019,Tweet,,,
"Congratulations to the teachers of Dedham, Massachusetts, on a successful strike and for securing a fair contract. It's past time we support our educators by giving them the pay and dignity they deserve. https://t.co/IaQtKGn8wl",Joe Biden,Tue Oct 29 17:15:00 +0000 2019,Tweet,,,
Paying off your kids' student loan debt can feel overwhelming. We need a president who understands that. https://t.co/VnCrEGh5mx,Joe Biden,Tue Oct 29 15:50:00 +0000 2019,Tweet,,,
1% of Americans put their lives on the line to defend the other 99% of us — we owe so much to our military men and women and their families. We must do better by those who sacrifice everything in service to our nation. https://t.co/4JPY5wzs14,Joe Biden,Tue Oct 29 14:02:00 +0000 2019,Tweet,,,
"In a Biden administration, our:

- Secretary of Education will be an educator
- EPA Administrator will know climate change is real
- Attorney General will defend the Constitution, not the president",Joe Biden,Tue Oct 29 00:27:00 +0000 2019,Tweet,,,
"Ten years ago, President Obama and I championed and signed into law the Matthew Shepard and James Byrd, Jr. Hate Crimes Prevention Act.

As president, I'll enforce our nation’s hate crime laws, reverse Trump’s cruel and discriminatory acts, and sign the Equality Act into law. https://t.co/dq7u0EpBzv",Joe Biden,Mon Oct 28 23:51:18 +0000 2019,Tweet,,,
"With less than 100 days until the Iowa Caucus, we need your help to build the strongest grassroots operation possible to win the nomination and make Donald Trump a one-term president.

Chip in what you can today: https://t.co/hygEOhiacs",Joe Biden,Mon Oct 28 23:10:00 +0000 2019,Tweet,,,
"This is not who we are. And as a nation, we will prove that next November. Families belong together. https://t.co/dvYvFuB0Vq",Joe Biden,Mon Oct 28 22:20:00 +0000 2019,Tweet,,,
"If President Trump had ever visited our troops serving in Afghanistan, he would know this isn't true. https://t.co/ASgJGfVoyC",Joe Biden,Mon Oct 28 20:17:44 +0000 2019,Tweet,,,
Donald Trump has no strategy for securing our nation against terrorist threats. He has no strategy for anything. Every day that he directs American national security is a dangerous day for the United States.,Joe Biden,Mon Oct 28 19:30:00 +0000 2019,Tweet,,,
"Kay Hagan was a courageous soul who lived every day of her too-short life with incredible dignity and character, even as the days became more difficult physically. Jill and I are deeply saddened by this news and extend our condolences to her entire family. https://t.co/XBqATmVRec",Joe Biden,Mon Oct 28 18:30:00 +0000 2019,Tweet,,,
"The Russians don't want me to be president, and Trump doesn't want me to be the nominee. But they picked a fight with the wrong guy — I’m not going anywhere.

We will make Donald Trump a one-term president. https://t.co/OrszKw9Up8",Joe Biden,Mon Oct 28 16:50:00 +0000 2019,Tweet,,,
No American President should welcome foreign interference in our elections. https://t.co/fKzqhS9EC7,Joe Biden,Mon Oct 28 02:06:00 +0000 2019,Tweet,,,
We cannot afford four more years of Donald Trump. https://t.co/KInHL475Gt,Joe Biden,Mon Oct 28 01:30:00 +0000 2019,Tweet,,,
"This is the United States of America — if we pick our heads up and remember who we are, there’s not a single thing we can’t do. https://t.co/x6H0KDWpVK",Joe Biden,Mon Oct 28 00:33:00 +0000 2019,Tweet,,,
Tonight on @60minutes I’ll lay out what I believe we need to do to ensure that America’s word means something again on the world stage. Tune in at 7pm ET.,Joe Biden,Sun Oct 27 19:49:00 +0000 2019,Tweet,,,
"I couldn’t agree more, @Springsteen. https://t.co/abQW4ZnlxX",Joe Biden,Sun Oct 27 19:30:38 +0000 2019,Tweet,,,
"To all those taking part in the Festival of Lights, Jill and I send warm wishes for a joyous celebration — Happy Diwali and Saal Mubarak. https://t.co/Lyrb65QmOZ",Joe Biden,Sun Oct 27 18:23:00 +0000 2019,Tweet,,,
"Today, we remember the lives taken one year ago at the Tree of Life Synagogue. We must constantly strive to live up to the American ideal that we're all created equal, while facing the harsh reality that hate has long torn us apart. The battle isn't over. We must end this hate.",Joe Biden,Sun Oct 27 17:45:00 +0000 2019,Tweet,,,
"I congratulate our special forces, our intelligence community, and all our brave military professionals on delivering justice to the terrorist Abu Bakr al-Baghdadi. The world is better and safer without him in it. https://t.co/miLSVWBT9l",Joe Biden,Sun Oct 27 15:16:08 +0000 2019,Tweet,,,
"Donald Trump and his administration have no idea what hard-working, decent, ordinary Americans are going through. They don’t understand the middle class. I do. https://t.co/r9t8xP5coN",Joe Biden,Sun Oct 27 14:13:00 +0000 2019,Tweet,,,
"Institutional racism should no longer exist. As president, I'll put forward change to help put an end to it. https://t.co/DQtPzGIfNq",Joe Biden,Sun Oct 27 00:46:12 +0000 2019,Tweet,,,
Even the dog knows that we can’t afford four more years of Donald Trump. https://t.co/AEZhBIoq0Y,Joe Biden,Sat Oct 26 22:17:34 +0000 2019,Tweet,,,
"If you work hard, you should be able to share in the prosperity. That basic bargain is broken — it's time we restore it for all American workers.

My plan will ensure all workers can bargain for the pay, benefits and workplace protections they deserve. https://t.co/nDK9O3fyly",Joe Biden,Sat Oct 26 21:03:00 +0000 2019,Tweet,,,
We only have 100 days left until the Iowa Caucus. Chip in what you can to help us restore the soul of our nation: https://t.co/jevK0T1Fj8 https://t.co/wP4D0H4EQC,Joe Biden,Sat Oct 26 19:45:00 +0000 2019,Tweet,,,
"Donald Trump promised he would work for the forgotten American — instead, he’s forgotten about them.

From day one, my administration will be focused on building an inclusive middle class to ensure everyone has a fair shot at a better future.
https://t.co/9L4RuKrzkg",Joe Biden,Sat Oct 26 18:56:00 +0000 2019,Tweet,,,
We only have 100 days left until the Iowa Caucus — and we need your help to organize and grow our team. Add your name to say you're ready to join the fight: https://t.co/GCxsKwomFH. https://t.co/YMZ7eCSuPD,Joe Biden,Sat Oct 26 17:01:00 +0000 2019,Tweet,,,
"I am proud to stand with the Asian American and Pacific Islander community, and the contributions they have made to America's rich diversity. 
 
Today, we're launching AAPIs for Biden — a coalition working to help me unite our nation. To join, visit: https://t.co/hHVSQBWeIY https://t.co/5Ce5MU5FQ2",Joe Biden,Sat Oct 26 16:24:46 +0000 2019,Tweet,,,
"There’s a war being waged on organized labor — and it’s only getting worse with President Trump in the White House. 

As president, I'll strengthen organizing and collective bargaining rights to strengthen unions. If you’re with me, join my campaign: https://t.co/giATOhj44a",Joe Biden,Sat Oct 26 00:43:00 +0000 2019,Tweet,,,
"Wall Street did not build the middle class — unions did. As president, I’ll ensure that workers are treated with dignity and respect. All workers must receive the pay, benefits and workplace protections they deserve. Read my plan: https://t.co/c4MyVLMxlD. https://t.co/ZHANcO7ghm",Joe Biden,Fri Oct 25 23:55:00 +0000 2019,Tweet,,,
.@SpeakerPelosi tiene razón. Trump y los Republicanos deberían dejar de jugar a la política y apoyar TPS para los Venezolanos ya. https://t.co/8nNoQSTQLT,Joe Biden,Fri Oct 25 21:52:40 +0000 2019,Tweet,,,
The Speaker is right. Trump and Senate Republicans should stop playing politics and support TPS protection for vulnerable Venezuelans now. https://t.co/8nNoQSTQLT,Joe Biden,Fri Oct 25 21:51:46 +0000 2019,Tweet,,,
Called into the @CTUlocal1 picket line to thank them for all they do for our students. It’s time we give our educators and school staff the pay and dignity they deserve. https://t.co/iGAayvJ2tg,Joe Biden,Fri Oct 25 21:21:05 +0000 2019,Tweet,,,
"Employers are interfering with workers’ efforts to organize and negotiate for a fair contract— it's wrong. 

My plan holds corporations and executives personally accountable for interfering with organizing efforts &amp; violating other labor laws. Learn more: https://t.co/c4MyVM48db",Joe Biden,Fri Oct 25 21:13:00 +0000 2019,Tweet,,,
"We are not prepared for a pandemic. Trump has rolled back progress President Obama and I made to strengthen global health security. We need leadership that builds public trust, focuses on real threats, and mobilizes the world to stop outbreaks before they reach our shores. https://t.co/1qqpgayUEX",Joe Biden,Fri Oct 25 20:32:28 +0000 2019,Tweet,,,
"A job is about a lot more than a paycheck—it’s about dignity, it’s about respect, it’s about being able to look your kid in the eye and say everything is going to be ok. Too many people today can’t say that.

We’ve got to rebuild the middle class and restore the dignity of work. https://t.co/we89bXzESZ",Joe Biden,Fri Oct 25 19:37:00 +0000 2019,Tweet,,,
"Today, I’m releasing my plan to strengthen worker organizing, collective bargaining, and unions.

To grow a stronger, more inclusive middle class — I'll make it easier for workers to unionize. It's time we start rewarding work, not wealth. Read my plan: https://t.co/c4MyVM48db. https://t.co/urgRVPu8pE",Joe Biden,Fri Oct 25 18:49:00 +0000 2019,Tweet,,,
"RT @TeamJoe : Young Americans face the fear of gun violence every day — even at school. They know @JoeBiden is the best candidate to take on our gun violence epidemic, and help them feel safe again. 

If you’re with them, join #TeamJoe: https://t.co/228KubiNSD https://t.co/16qy0t3ZEh",Joe Biden,Fri Oct 25 18:43:23 +0000 2019,Retweet,,,
Congressman Elijah Cummings was a lion of democracy and a powerful ally in the fight for the soul of our nation. I am honored to have served alongside him and known him as a friend. May his passion and purpose live on as he rests in heavenly peace.,Joe Biden,Fri Oct 25 18:23:00 +0000 2019,Tweet,,,
"President Trump’s abdication of American leadership on climate change is dangerous. If we give him four more years, our planet may never recover.

On day one, I’ll rejoin the Paris Agreement and rally the world to push our progress further and faster. https://t.co/NTeEjxbYln",Joe Biden,Fri Oct 25 01:30:00 +0000 2019,Tweet,,,
"Donald Trump lacks the moral authority to lead our country. Every day he spends in the White House, he further debases the values and ideals of our nation. We must make him a one-term president.",Joe Biden,Fri Oct 25 00:35:00 +0000 2019,Tweet,,,
"If I'm elected president, my children will not sit in on Cabinet meetings or have offices in the White House. https://t.co/ouGpUpjyYJ",Joe Biden,Thu Oct 24 23:51:00 +0000 2019,Tweet,,,
The powerful gun lobby has controlled our politics for far too long. Enough is enough. We the people own this country — not the @NRA.,Joe Biden,Thu Oct 24 23:30:00 +0000 2019,Tweet,,,
Donald Trump inherited a growing economy from the Obama-Biden Administration. And just like everything else he’s inherited in his life — he’s in the process of squandering it. https://t.co/wZFKqjb8r2,Joe Biden,Thu Oct 24 22:40:00 +0000 2019,Tweet,,,
The United States of America can be defined by one word: Possibilities. https://t.co/C9IKvhlHNk,Joe Biden,Thu Oct 24 20:23:00 +0000 2019,Tweet,,,
"I'm running for president to rebuild the backbone of our country—the middle class. And this time, we'll bring everyone along, so every American family can live a life of dignity.

If you’re with me, join the campaign by pitching in what you can today: https://t.co/mqQ09RPYuI",Joe Biden,Thu Oct 24 18:52:00 +0000 2019,Tweet,,,
"At a time when labor is under attack and Trump's reckless trade wars threaten millions more farms and families around the country, @TimRyan has been a clear voice for those at risk of being left behind. He'll continue to be a fierce force for them in Congress.",Joe Biden,Thu Oct 24 18:17:00 +0000 2019,Tweet,,,
"I strongly support the Senate's approval of North Macedonia's NATO membership. The countries of the Western Balkans deserve to be part of a Europe whole, free and at peace and we should be supporting Euro-Atlantic integration across the region. 
https://t.co/UUyOWL20z7",Joe Biden,Thu Oct 24 00:02:00 +0000 2019,Tweet,,,
"As president, I would press for dialogue to prevent further violence and instability. Investing in Haiti’s prosperity and security is in the national security interest of the United States.",Joe Biden,Wed Oct 23 23:25:48 +0000 2019,Reply,,,
The Trump Administration is abandoning the Haitian people while the country’s political crisis is paralyzing that nation. https://t.co/fdnCLnLQ0a,Joe Biden,Wed Oct 23 23:25:48 +0000 2019,Tweet,,,
"I'm proud to stand with @seiuhcpa and Regional Hospital of Scranton workers in their fight for higher wages, access to affordable health insurance, and a fair contract that invests in the future of their hospital.",Joe Biden,Wed Oct 23 23:01:00 +0000 2019,Tweet,,,
"Hoy estamos lanzando Todos con Biden. Los latinos han contribuido mucho a nuestro país—son parte del tejido de Estados Unidos y se merecen un presidente que les respete y que luchará junto a ellos.

Acompáñenme a continuar y mejorar los logros realizados: https://t.co/xa3EGpkpEf https://t.co/q04NjmAfmb",Joe Biden,Wed Oct 23 20:38:00 +0000 2019,Tweet,,,
"Today, we're launching Todos con Biden. Latinos have contributed so much to our country—you're part of the fabric of America &amp; you deserve a president who respects you &amp; will fight alongside you.

Join me as we continue to build on the progress we've made: https://t.co/7c2ZAB1Yf4 https://t.co/GChKfKsu12",Joe Biden,Wed Oct 23 20:32:00 +0000 2019,Tweet,,,
Donald Trump has no idea what it means to be a part of the middle class. I do. https://t.co/ewJ1ZKymG6,Joe Biden,Wed Oct 23 19:28:13 +0000 2019,Tweet,,,
"Let’s be clear, this ban is dangerous and directly violates a woman's constitutional right to choose. We must stop it.
 
As president, I will codify Roe into federal law and ensure this choice remains between a woman and her doctor. https://t.co/IFgnRjBm8N",Joe Biden,Wed Oct 23 19:22:00 +0000 2019,Tweet,,,
"Rooted in Scranton, fortified in the halls of Congress, and proven in the White House — my values have never changed, and they never will. I won’t stop fighting for the hardworking Americans who make our country run every single day. https://t.co/wNRzK1iso1",Joe Biden,Wed Oct 23 18:05:00 +0000 2019,Tweet,,,
Let's get something straight — unions built the middle class. https://t.co/Zfp1rJP8NY,Joe Biden,Wed Oct 23 16:56:00 +0000 2019,Tweet,,,
"We all want the same thing — a life of dignity and a fair shot at a better future.

Donald Trump isn't capable of understanding that. https://t.co/XwojGzfmY2",Joe Biden,Wed Oct 23 15:52:00 +0000 2019,Tweet,,,
"WATCH LIVE: Joe Biden Speaks in Scranton, Pennsylvania https://t.co/yNWHciXiGS",Joe Biden,Wed Oct 23 14:18:29 +0000 2019,Tweet,,,
"This morning, I’ll be in my hometown of Scranton, Pennsylvania, to discuss my plans to build a middle class where everyone comes along. Tune in at 10:00 AM ET to watch live: https://t.co/miqSzSTQfF",Joe Biden,Wed Oct 23 13:19:08 +0000 2019,Tweet,,,
"Once again, Putin and the Russians are interfering in the elections and trying to pick our president -- this time they're coming after me.

Chip in $5 to send the message to Putin that the American people decide elections, not him: https://t.co/6ehaYAjgxA https://t.co/o1GTKnizUY",Joe Biden,Wed Oct 23 12:55:44 +0000 2019,Tweet,,,
This wasn’t the right word to use and I’m sorry about that. Trump on the other hand chose his words deliberately today in his use of the word lynching and continues to stoke racial divides in this country daily. https://t.co/mHfFC8HluZ,Joe Biden,Wed Oct 23 02:23:20 +0000 2019,Tweet,,,
"The moral obligation of our time is to restore, rebuild, and respect the backbone of America—the middle class. That mission will be my North Star as president.",Joe Biden,Tue Oct 22 22:50:00 +0000 2019,Tweet,,,
Our gun and domestic violence epidemics are linked — and we must take action to end them both. Leader McConnell should allow a vote on the House-passed VAWA reauthorization to close loopholes and keep firearms out of the hands of dangerous individuals. https://t.co/ZSPWyJAgjl,Joe Biden,Tue Oct 22 20:45:00 +0000 2019,Tweet,,,
"Campbell is an incredible young man, and I’m proud to have played a small part in his journey.

To anyone working to overcome a stutter, my message is clear: never give up and never let it define you. #ISAD https://t.co/e7JRgVRV3a",Joe Biden,Tue Oct 22 19:38:00 +0000 2019,Tweet,,,
"There used to be a basic bargain in America—when your company did well, you shared in the prosperity. We must restore that bargain &amp; stand up to corporate profiteering.

I support @Teamsters25 as they strike against @RepublicService for a living wage, health care, and pensions.",Joe Biden,Tue Oct 22 18:15:00 +0000 2019,Tweet,,,
"Impeachment is not ""lynching,"" it is part of our Constitution. Our country has a dark, shameful history with lynching, and to even think about making this comparison is abhorrent. It's despicable. https://t.co/QcC25vhNeb",Joe Biden,Tue Oct 22 17:10:22 +0000 2019,Tweet,,,
"Las armas de asalto y los cartuchos de alta capacidad no tienen lugar en nuestras comunidades. Yo me enfrente al @NRA una vez antes para prohibirlos, y lo volveré a hacer en la Casa Blanca. https://t.co/e8TmUxKfej",Joe Biden,Tue Oct 22 15:40:00 +0000 2019,Tweet,,,
"We are truly in a battle for the soul of our nation, and it’s up to all of us to stand up and reject intolerance in all its forms. We must give hate no safe harbor. https://t.co/WeDGPCt9to",Joe Biden,Tue Oct 22 00:31:18 +0000 2019,Tweet,,,
"The Russian Facebook trolls are back — and this time, they're going after my campaign. We cannot let 2016 repeat itself.

Chip in $5 to our rapid response fund to help us fight back against their lies and foreign interference in our elections: https://t.co/6ehaYAjgxA https://t.co/9Zllaa9a5U",Joe Biden,Mon Oct 21 23:16:24 +0000 2019,Tweet,,,
"Donald Trump talks tough on trade but has nothing to show for it—other than pain for America's families. Mike Pence has been his complicit sidekick, propping up Trump’s reckless trade wars and slighting hard-working Americans across the country. https://t.co/DPQRNCeA0A",Joe Biden,Mon Oct 21 22:35:00 +0000 2019,Tweet,,,
"Assault weapons and high-capacity magazines have no place in our communities. I’ve taken on the @NRA to ban them once before, and I’ll do it again in the White House. https://t.co/e8TmUxKfej",Joe Biden,Mon Oct 21 18:45:00 +0000 2019,Tweet,,,
"RT @GiffordsCourage : For @JoeBiden, Sandy Hook was a breaking point.

In his own words, watch him describe meeting the families and first responders of Newtown—and how this resonated with his own experience of losing a child. #GunSafetyPresident https://t.co/frfrgwl4VL https://t.co/JKJKdfy8jB",Joe Biden,Mon Oct 21 17:47:18 +0000 2019,Retweet,,,
"After the most corrupt administration in modern history, the next president faces a big task: restoring faith in American government. A Biden administration will ensure our government works for all Americans — not just the powerful. https://t.co/Jy1UKwH7jd",Joe Biden,Mon Oct 21 17:01:00 +0000 2019,Tweet,,,
"In the United States, health care should be a right for all — not a privilege for the few. As president, I will give Americans a new choice — a Medicare-like public option — to ensure everyone has access to the quality, affordable care they need. https://t.co/gm6jgUrcaT",Joe Biden,Mon Oct 21 14:45:00 +0000 2019,Tweet,,,
"Donald Trump has asked three foreign governments to interfere in our elections on his behalf. In full view of the American people, he has violated his oath of office and betrayed our nation.

He must be impeached.",Joe Biden,Mon Oct 21 00:28:00 +0000 2019,Tweet,,,
Four years of Betsy DeVos is more than enough. We’re going to make sure the next Secretary of Education is a teacher. https://t.co/6Bn4k3ATDl,Joe Biden,Sun Oct 20 23:40:00 +0000 2019,Tweet,,,
"I’m not going to be distracted by all of President Trump's lies, smears, distortions, and name-calling. I’m going to stay focused on the issues that matter to you—because action cannot wait when it comes to health care, or jobs, or education, or guns, or climate.",Joe Biden,Sun Oct 20 21:42:00 +0000 2019,Tweet,,,
"Thoughts and prayers won’t end our gun violence epidemic. 

It’s past time we take on the @NRA and pass common-sense gun safety reform — that starts with banning assault weapons and high-capacity magazines and requiring universal background checks.",Joe Biden,Sun Oct 20 18:06:00 +0000 2019,Tweet,,,
Hosting the G7 at Trump’s hotel? A president should never be able to use the office for personal gain.,Joe Biden,Sun Oct 20 00:12:00 +0000 2019,Tweet,,,
