Text,Name,Created At,Tweet Type,,,
"Back when Kamala was Attorney General, she worked closely with Beau. I watched as they took on the big banks, lifted up working people, and protected women and kids from abuse. I was proud then, and I'm proud now to have her as my partner in this campaign.",Joe Biden,Tue Aug 11 20:17:32 +0000 2020,Reply,,,
"I have the great honor to announce that I’ve picked @KamalaHarris — a fearless fighter for the little guy, and one of the country’s finest public servants — as my running mate.",Joe Biden,Tue Aug 11 20:17:32 +0000 2020,Tweet,,,
"Don't forget that in the middle of this pandemic, the Trump Administration is in court trying to eliminate Obamacare and rip health insurance away from millions. It's heartless.

I'll protect and build on the ACA to ensure everyone gets the care they need. https://t.co/IwFG48ED9h",Joe Biden,Tue Aug 11 16:00:00 +0000 2020,Tweet,,,
"I promise you if I'm elected, I won't waste any time getting this virus under control.

I'll call Dr. Fauci and ask him to stay on. I'll bring together top experts and leaders from both parties to chart a path forward.

We'll get it done, together.",Joe Biden,Tue Aug 11 13:20:00 +0000 2020,Tweet,,,
"This is the latest dire consequence of Donald Trump looking the other way on Beijing's repression in Hong Kong. Instead of standing for freedom and democracy, he consistently stands with Xi Jinping.

I'll put American values back at the center of our foreign policy. https://t.co/3RAZOeVtHr",Joe Biden,Tue Aug 11 02:31:28 +0000 2020,Tweet,,,
Social Security is the bedrock of American retirement — giving countless Americans peace of mind and the ability to retire with dignity. I've been fighting to protect and expand the program throughout my career — and I'll continue that fight as president.,Joe Biden,Tue Aug 11 00:40:00 +0000 2020,Tweet,,,
"Folks, we need to listen to our frontline heroes. Wear a mask. It’s not just about you. It’s about keeping your family, neighbors, and fellow citizens safe. https://t.co/pbI6UVhqvh",Joe Biden,Mon Aug 10 22:30:00 +0000 2020,Tweet,,,
Bristol Bay is no place for a mine — our administration decided that in 2014. We're only discussing it today because Donald Trump's EPA reversed course hours after a closed-door meeting with the mining company's CEO. https://t.co/RG38v0dRDk,Joe Biden,Mon Aug 10 21:00:00 +0000 2020,Tweet,,,
"Donald Trump said that if he’s re-elected, he’ll defund Social Security.

We can't let that happen.",Joe Biden,Mon Aug 10 20:43:00 +0000 2020,Tweet,,,
"President Trump keeps attacking the U.S. Postal Service, and now hundreds of thousands of veterans aren't getting their life-saving medications on time. It's despicable.

I promise you that as president, I will never put politics over the care of our nation's veterans. https://t.co/aXryhxVRtG",Joe Biden,Mon Aug 10 18:20:00 +0000 2020,Tweet,,,
"Donald Trump’s surrender to the pandemic has led to a resurgence of the virus and more economic pain and anxiety for millions of Americans. 

After six months of a nation in crisis, he still has no plan to get us through. But I do: https://t.co/SOVOPL7uPy",Joe Biden,Mon Aug 10 17:10:00 +0000 2020,Tweet,,,
"To the millions of Americans struggling to get by right now — those who can't find a job or pay the bills: I want you to know that I see you, and I won't forget you — and I'm going to fight every day in the White House to build an economy that works for you.",Joe Biden,Mon Aug 10 15:15:00 +0000 2020,Tweet,,,
Every single eligible American should have the opportunity to vote-by-mail this November. If it's good enough for Donald Trump — then it's good enough for you and me.,Joe Biden,Sun Aug 09 21:30:00 +0000 2020,Tweet,,,
We can’t let Donald Trump destroy the U.S. Postal Service.,Joe Biden,Sun Aug 09 19:15:00 +0000 2020,Tweet,,,
It's been six years since Michael Brown's life was taken in Ferguson — reigniting a movement. We must continue the work of tackling systemic racism and reforming policing.,Joe Biden,Sun Aug 09 17:00:00 +0000 2020,Tweet,,,
Our planet can’t take four more years of Donald Trump. We have to get him out of the White House so we can start treating the climate crisis like the urgent threat it is.,Joe Biden,Sun Aug 09 15:00:02 +0000 2020,Tweet,,,
RT @TeamJoe : We seriously can’t wait to see who’s going to join #TeamJoe! Text FIRST to 30330 to be the first to know when @JoeBiden makes his VP announcement.,Joe Biden,Sun Aug 09 14:24:10 +0000 2020,Retweet,,,
"Giving the Trump administration another four years in office would have catastrophic implications for future generations. His victory would threaten the future of our democracy, and we must vote him out this November. https://t.co/iIFPTIB1Er",Joe Biden,Sun Aug 09 13:00:00 +0000 2020,Tweet,,,
"The United States just passed 5 million reported infections of COVID-19. It’s a number that boggles the mind and breaks the heart. Each time the number goes up, it represents a life altered, a family stricken with anxiety, a community on edge. It shouldn’t have gotten this bad.",Joe Biden,Sun Aug 09 01:00:01 +0000 2020,Tweet,,,
"Today, Donald Trump stated that if re-elected, he'll undermine the entire financial footing of Social Security.

Our seniors and millions of Americans with disabilities are under enough stress without their hard-earned Social Security benefits in doubt. https://t.co/glUDQlcbEO",Joe Biden,Sun Aug 09 00:30:00 +0000 2020,Tweet,,,
"Donald Trump has refused to take serious action to combat the COVID-19 crisis. And as a result, he got what he’s always wanted — the U.S. isolated from the rest of the world. https://t.co/owvNL4ul74",Joe Biden,Sun Aug 09 00:00:00 +0000 2020,Tweet,,,
"It’s an important choice, and I want you to be one of the first to know who I’ve picked as my running mate – text FIRST to 30330 to get notified when I’ve made my decision.",Joe Biden,Sat Aug 08 22:30:00 +0000 2020,Tweet,,,
"Between the coronavirus and the economic crisis, this is a tough time for our country, I know. But I firmly believe that our best days still lie ahead. Together, we will climb out of these crises and emerge stronger than before.",Joe Biden,Sat Aug 08 21:15:00 +0000 2020,Tweet,,,
"The fact is, Donald Trump left our nation unprepared and unprotected for the worst public health crisis of our lifetime — and we're paying the price every single day. https://t.co/sZJCdivRo3",Joe Biden,Sat Aug 08 19:00:01 +0000 2020,Tweet,,,
"Our nation is desperate for leadership — leadership that can unite us and steer us through these crises. But at the most critical moment of his presidency, Donald Trump has nothing to offer.",Joe Biden,Sat Aug 08 16:45:00 +0000 2020,Tweet,,,
"No President can promise to prevent future outbreaks. But I'll promise you this: when I'm President we will prepare better, respond better, and recover better.",Joe Biden,Sat Aug 08 15:00:00 +0000 2020,Tweet,,,
"Over the last century, America has defined itself by rising to meet existential challenges — and we have that opportunity once again. But we can’t just build back to the way things were before, we have to build back better.

Here’s my plan for how we’ll do it: https://t.co/nuBqg0TIfP",Joe Biden,Sat Aug 08 14:00:01 +0000 2020,Tweet,,,
"John Lewis will be remembered as a moral giant who dedicated his life to creating a more just, equal, and moral America.

Donald Trump will not. https://t.co/vfZFeCUX3S",Joe Biden,Sat Aug 08 13:00:01 +0000 2020,Tweet,,,
"I can’t believe I have to say this, but we can’t let Donald Trump open up the Grand Canyon for uranium mining.",Joe Biden,Sat Aug 08 00:50:00 +0000 2020,Tweet,,,
"I believe every American deserves a fair shot at success — not just the Mar-a-Lago crowd. That’s why as president, I’ll reverse Donald Trump’s giant tax giveaways to the super-wealthy and big corporations, and build an economy that works for everyone.",Joe Biden,Fri Aug 07 22:53:00 +0000 2020,Tweet,,,
It didn't have to be this bad. https://t.co/xwdxgizLLH,Joe Biden,Fri Aug 07 20:45:00 +0000 2020,Tweet,,,
"Here’s the truth—Donald Trump turned his back on the middle class long before COVID-19. He cut taxes for the super-wealthy, drove U.S. manufacturing into a recession, and stacked the deck against hardworking Americans.

It's time we pick a different path. https://t.co/rt5RD9WOGA",Joe Biden,Fri Aug 07 19:22:00 +0000 2020,Tweet,,,
Make no mistake: This economic crisis is due to President Trump’s failure to get this virus under control. https://t.co/CBbk6SV39Q,Joe Biden,Fri Aug 07 17:15:00 +0000 2020,Tweet,,,
"While I am grateful for the people who got their jobs back, my heart goes out to the more than 16 million Americans still out of work. The truth is it didn't have to be this bad, but Donald Trump failed to act. He's the one person who should lose his job. https://t.co/eIHGRjwJd3",Joe Biden,Fri Aug 07 15:45:00 +0000 2020,Tweet,,,
The truth is that President Trump could have acted months ago to curb this pandemic—it's obvious he still hasn’t learned his lesson. He continues to ignore the warnings of health experts and we're all paying the price. https://t.co/JOgA5Gpop4,Joe Biden,Fri Aug 07 11:01:21 +0000 2020,Reply,,,
"Here’s how COVID-19 affected Arizonans under the Trump—Ducey model:

- An infection rate—still—of nearly 20%
- The fifth-highest number of current hospitalizations in the country
- More than 4,000 deaths from COVID-19
- More than 183,000 cases
- Lengthy delays in test results",Joe Biden,Fri Aug 07 11:01:21 +0000 2020,Reply,,,
"Gov. Ducey is rushing reopening without adequate testing and contact tracing.

He’s withholding support for increased testing and making local leaders plead for it.

He’s refusing to implement a mask mandate and turning his back on older Americans and those at greater risk.",Joe Biden,Fri Aug 07 11:01:21 +0000 2020,Reply,,,
President Trump called Arizona “a model for applying a science-based approach to the decreasing cases and hospitalizations without implementing a punishing lockdown.” He said Governor Ducey’s approach should be used by other states—but here’s what’s really happening in Arizona:,Joe Biden,Fri Aug 07 11:01:20 +0000 2020,Tweet,,,
"My commitment to you is this: I will always listen, I will never stop fighting for the African American community and I will never stop fighting for a more equitable future.",Joe Biden,Fri Aug 07 01:03:47 +0000 2020,Reply,,,
"Throughout my career I've witnessed the diversity of thought, background, and sentiment within the African American community. It's this diversity that makes our workplaces, communities, and country a better place.",Joe Biden,Fri Aug 07 01:03:47 +0000 2020,Reply,,,
"Earlier today, I made some comments about diversity in the African American and Latino communities that I want to clarify. In no way did I mean to suggest the African American community is a monolith—not by identity, not on issues, not at all.",Joe Biden,Fri Aug 07 01:03:47 +0000 2020,Tweet,,,
"RT @TeamJoe : 🚨 BIG NEWS 🚨

We just announced our first grassroots fundraiser with Joe's VP pick!

As soon as she's announced, supporters like you have the chance to hear directly from her.

Reserve your spot by chipping in to help Joe ~ and her ~ win this election: https://t.co/Xjf2EvCzH0",Joe Biden,Fri Aug 07 00:43:53 +0000 2020,Retweet,,,
"I believe that the right to vote is the most fundamental American right there is. To protect it, we’ve got to:

- Pass the John R. Lewis Voting Rights Act
- Enact automatic and same-day voter registration
- Stand up to Republican voter suppression efforts",Joe Biden,Fri Aug 07 00:15:00 +0000 2020,Tweet,,,
John Lewis left us with marching orders. It’s up to all of us to carry them out: https://t.co/Hy8C4mIL2M https://t.co/MTc6WHNnSR,Joe Biden,Thu Aug 06 23:15:00 +0000 2020,Tweet,,,
"Every moment with your loved ones is precious. I know that in my core because I’ve learned it through loss. It's why as president, I'm going to do everything I can to get this virus under control and get our lives back to normal as soon as we can. https://t.co/qCsvryHMai",Joe Biden,Thu Aug 06 22:05:00 +0000 2020,Tweet,,,
Let me be clear: Voting is a right — not a privilege. Anyone who tells you otherwise can’t be trusted to hold the highest office in this land.,Joe Biden,Thu Aug 06 20:25:00 +0000 2020,Tweet,,,
"The fight for civil rights is what drove me to get involved in politics in the first place. It's why I fought for and helped secure a 25-year extension of the Voting Rights Act. And it's why as president, I'll immediately sign the John R. Lewis Voting Rights Act into law. https://t.co/fHqUvYahRR",Joe Biden,Thu Aug 06 18:45:00 +0000 2020,Tweet,,,
"55 years ago today, the Voting Rights Act was signed into law — bringing us one step closer to that more perfect union. As we mark its anniversary, we’ve got to continue our fight to restore the VRA and protect the sacred right to vote.",Joe Biden,Thu Aug 06 17:02:00 +0000 2020,Tweet,,,
The scenes of death and destruction from Hiroshima and Nagasaki still horrify us 75 years later. They reach through history to remind us of the hideous damage nuclear weapons can inflict—and our collective responsibility to ensure they're never again used. https://t.co/357jRzBPeL,Joe Biden,Thu Aug 06 16:24:00 +0000 2020,Tweet,,,
"If I'm elected president, our students and educators will have all the tools and resources they need to succeed and get through COVID-19. https://t.co/ul9vTTcT40",Joe Biden,Thu Aug 06 13:45:00 +0000 2020,Tweet,,,
"Donald Trump promised to bring back jobs, but his policies crushed the manufacturing sector—and that was true even before COVID-19.

I’ll revitalize American manufacturing and innovation and create millions of good-paying jobs so we can build back better. https://t.co/HrOOkWWQof",Joe Biden,Thu Aug 06 00:40:00 +0000 2020,Tweet,,,
"Growing up in Scranton, I learned the importance of hard work, treating others with dignity and respect, and leaving no one behind. Those values have guided my entire life — and they're the values I'll bring back to the White House. https://t.co/aelfrxaISg",Joe Biden,Wed Aug 05 23:45:00 +0000 2020,Tweet,,,
"Folks, a lot of you have been asking when I’m announcing my running mate, and I promise I’ll let you know soon. But here’s what I can tell you right now: I’m going to tell my supporters first — so text FIRST to 30330 to be the first to know.",Joe Biden,Wed Aug 05 23:00:00 +0000 2020,Tweet,,,
"I don’t buy for one second that the vitality of American manufacturing is a thing of the past. As president, I'll make bold investments in American manufacturing, industry, and innovation to make sure the future is made in America — by all of America. https://t.co/LkIi8g6M5i",Joe Biden,Wed Aug 05 22:30:00 +0000 2020,Tweet,,,
There's been a lot of talk about my vetting process lately. Here’s an inside look: https://t.co/tFRKJOE3hi,Joe Biden,Wed Aug 05 20:40:00 +0000 2020,Tweet,,,
"Weapons of war have no place in our communities. When I was a senator, I took on the @NRA and secured a 10-year ban on assault weapons — and as president, I’ll ban these weapons again. https://t.co/ggqSaj40EJ",Joe Biden,Wed Aug 05 19:15:00 +0000 2020,Tweet,,,
"Eight years ago, a white supremacist targeted a Sikh temple in Oak Creek, WI — ultimately taking seven lives in an unspeakable act of terror. To truly honor those we lost, it's up to all of us to stand up to bigotry in our lives, give hate no safe harbor, and reduce gun violence.",Joe Biden,Wed Aug 05 18:15:00 +0000 2020,Tweet,,,
"I truly believe that we can revitalize American manufacturing and create a better economy at the same time. I want to build an economy that brings everyone along — one that works for the middle class, not just the wealthy and well-connected. https://t.co/3fYbFfsvDb",Joe Biden,Wed Aug 05 16:03:00 +0000 2020,Tweet,,,
"The truth of the matter is, Donald Trump inherited a growing economy from President Obama and me. And just like everything else he inherited in his life, he squandered it. https://t.co/EPxDx4ecoU",Joe Biden,Wed Aug 05 13:10:00 +0000 2020,Tweet,,,
"From day one, Donald Trump downplayed the threat COVID-19 posed, ignored scientists, and refused to take action. 

Now, nearly 5 million cases and more than 150,000 deaths later, it's crystal clear we're paying the price for his failed leadership.",Joe Biden,Wed Aug 05 00:50:00 +0000 2020,Tweet,,,
"On day one, I’ll send a bill to Congress creating a clear roadmap to citizenship for Dreamers and the 11 million undocumented people already strengthening our nation. It’s long overdue. https://t.co/ajO7uUb9po",Joe Biden,Tue Aug 04 23:30:00 +0000 2020,Tweet,,,
"Our hearts and prayers are with the people of Lebanon, and the victims of the horrific explosion in Beirut. I urge both the Trump Administration and international community to immediately mobilize assistance to the thousands injured in the blast.",Joe Biden,Tue Aug 04 22:40:00 +0000 2020,Tweet,,,
"Thousands of Americans are dying every week. The President's response?

""It is what it is."" https://t.co/GT59hr14kb",Joe Biden,Tue Aug 04 21:12:00 +0000 2020,Tweet,,,
"I’ll get to work on day one enacting the changes needed to help the Latino community thrive.

Read my full plan here: https://t.co/SaL4WaFkEA https://t.co/vhwTRcwHlO",Joe Biden,Tue Aug 04 20:41:00 +0000 2020,Tweet,,,
"Happy birthday to my brother and friend, @BarackObama! Serving alongside you for eight years was the greatest honor of my life — and I'm grateful to have you by my side for these next 91 days. https://t.co/qLl42Im40C",Joe Biden,Tue Aug 04 18:50:00 +0000 2020,Tweet,,,
"We can’t just build back to the way things were before these crises. We have to build a more inclusive, equitable future for all.

Here’s how we’ll do it: https://t.co/SaL4WanJN2 https://t.co/IeMtNqBynx",Joe Biden,Tue Aug 04 18:18:00 +0000 2020,Tweet,,,
"The Latino community is bearing disproportionate harm from this pandemic. But even before, many Latino families were already struggling. We've got to do better. That's why today, I'm releasing my new agenda for the Latino community: https://t.co/xgGUoleGQO",Joe Biden,Tue Aug 04 15:46:00 +0000 2020,Tweet,,,
"As president, I’ll take on the powerful gun lobby to pass universal background checks, ban assault weapons and high-capacity magazines, and close loopholes to keep guns out of dangerous hands. We can and will end our gun violence epidemic.",Joe Biden,Tue Aug 04 15:25:26 +0000 2020,Reply,,,
"One year ago, just hours after the massacre in El Paso, nine precious lives were cut short in Dayton. In the wake of the tragedies, Donald Trump promised the most modest of gun safety policies, then caved to the @NRA and failed to deliver.",Joe Biden,Tue Aug 04 15:25:26 +0000 2020,Tweet,,,
"On July 1st, Donald Trump predicted the coronavirus was going to ""just disappear.""

He was wrong — and more than 25,000 Americans died due to the virus last month.

Mr. President, step up and do your job before even more American families feel the pain of losing a loved one.",Joe Biden,Tue Aug 04 11:30:00 +0000 2020,Tweet,,,
"When we spend taxpayer money, we should use it to buy American products and support American jobs. Period.

We’re going to make sure the future is made in America — by all of America: https://t.co/uTI6GyuTpX",Joe Biden,Tue Aug 04 01:39:00 +0000 2020,Tweet,,,
"Not a joke, folks.

Get yours today: https://t.co/RqCQJE8Kho https://t.co/A1CNMOu2ct",Joe Biden,Tue Aug 04 01:02:00 +0000 2020,Tweet,,,
"Every American should be able to safely make their voice heard this November. We need to:

- Expand vote-by-mail and early voting
- Implement online voter registration
- Make it safe and easy to vote in-person",Joe Biden,Mon Aug 03 23:45:00 +0000 2020,Tweet,,,
Jill and I mourn the loss of the nine service members who perished in a training accident off the coast of California. These brave young men made the ultimate sacrifice in service to their fellow Americans. Our deepest condolences go out to their families.,Joe Biden,Mon Aug 03 23:08:00 +0000 2020,Tweet,,,
"John Hume committed his life to the principles of nonviolence, and through his faith, statesmanship, and perseverance, he helped bring Northern Ireland through the Troubles to a better tomorrow. Jill and I send our condolences to the entire Hume family. https://t.co/5QmRsj2fSb",Joe Biden,Mon Aug 03 21:40:00 +0000 2020,Tweet,,,
"In the days that followed the El Paso shooting, I said Americans have to come together, stand against hate, and leave nobody behind.

That charge feels more important than ever. This is our fight — and together, we will win. https://t.co/eX2xD0jhjX",Joe Biden,Mon Aug 03 20:25:00 +0000 2020,Tweet,,,
"It's hard to believe this has to be said, but if I'm elected president, I’ll spend my Monday mornings working with our nation’s top experts to control this virus — not insulting them on Twitter. https://t.co/o7p3e0kgRJ",Joe Biden,Mon Aug 03 18:16:00 +0000 2020,Tweet,,,
"This is a moment to summon the purpose we felt one year ago after El Paso. A moment to recommit to the battle for the soul of this nation. A battle against white supremacy, hatred, and gun violence.

It won't be easy — but it's a battle we must win.",Joe Biden,Mon Aug 03 17:22:00 +0000 2020,Tweet,,,
"One year ago, a white supremacist armed with a semi-automatic rifle targeted the people of El Paso. He thought his hatred of Latinos and immigrants would prove more powerful than the culture and vibrancy of the community.

He was wrong. https://t.co/d7ISze6dK7",Joe Biden,Mon Aug 03 15:42:00 +0000 2020,Tweet,,,
"Folks, there's simply too much at stake this November for anyone to sit on the sidelines. Register to vote today — and then reach out to five friends and get them registered as well. https://t.co/8XWNjhwJzL",Joe Biden,Sun Aug 02 23:45:00 +0000 2020,Tweet,,,
"Welcome home, Bob and Doug! The first American splashdown in 45 years was executed with precision, and is truly a victory for American innovation and persistence. Congratulations to everyone involved on a successful conclusion to this historic mission. https://t.co/kYBNCHL75O",Joe Biden,Sun Aug 02 21:09:00 +0000 2020,Tweet,,,
Join us as we host a roundtable with Congresswoman Veronica Escobar to commemorate the anniversary of the El Paso Massacre: https://t.co/LPA5wDYvNF,Joe Biden,Sun Aug 02 21:03:15 +0000 2020,Tweet,,,
It’s not enough to just go back to the way things were before these crises — we need to build back better than ever. We have to create a new American economy where everyone gets a fair return for their work and an equal chance to get ahead.,Joe Biden,Sun Aug 02 19:00:00 +0000 2020,Tweet,,,
"Now more than ever, we need a president who believes in science.",Joe Biden,Sun Aug 02 16:40:00 +0000 2020,Tweet,,,
This pandemic has put a bright light on the disparities that have plagued our nation for too long. We’ve got to make sure these communities get the help they need now — and root out the systemic racism that created these inequalities in the first place. https://t.co/KZZx2T9ojT,Joe Biden,Sun Aug 02 14:35:00 +0000 2020,Tweet,,,
"Enhanced unemployment benefits expired for millions overnight.

We don’t have an effective nationwide testing program or a plan to control the virus.

Our health care workers still don’t have enough PPE.

Enough with the weekend golf trips, Mr. President. Do your job.",Joe Biden,Sat Aug 01 23:59:00 +0000 2020,Tweet,,,
"Rent is due today.

Donald Trump abdicated his responsibility to lead us out of this COVID-19 crisis—and we now face a potential housing crisis because of it.

Mr. President: Act now to make sure Americans don't have to choose between a roof over their heads or food on the table. https://t.co/b0Uoy5qoFr",Joe Biden,Sat Aug 01 21:55:00 +0000 2020,Tweet,,,
You have enough on your plate — you shouldn't also have to worry about the president making things even tougher for you. https://t.co/HjwhG8kQMT,Joe Biden,Sat Aug 01 20:45:00 +0000 2020,Tweet,,,
"If we give Donald Trump four more years in the White House, he will forever alter the character of this nation.

We can’t let that happen.",Joe Biden,Sat Aug 01 18:20:00 +0000 2020,Tweet,,,
"To the millions of people who get up every single day and make this country run: I see you, and I promise I will never stop fighting for you. You are the backbone of America. https://t.co/009KRZx9Bq",Joe Biden,Sat Aug 01 15:35:00 +0000 2020,Tweet,,,
"Ordinary people doing extraordinary things. That's the story of America — and it's being written every day by folks like Dr. @Craig_A_Spencer, who fought the Ebola outbreak and now COVID-19. @BarackObama and I called to thank him for his service and discuss the moment we're in. https://t.co/wO14pwaaxa",Joe Biden,Sat Aug 01 12:40:00 +0000 2020,Tweet,,,
"Folks, we’re just a few hours away from our critical end-of-month fundraising deadline. We need everyone to step up so we can hit our goal and make sure we can go toe-to-toe with President Trump.

If you're able, please chip in today: https://t.co/XAsy8zaW2v",Joe Biden,Fri Jul 31 23:59:00 +0000 2020,Tweet,,,
"Jill and I are keeping everyone in the path of Hurricane Isaias in our prayers. We must ensure that our fellow Americans, in Puerto Rico and across the East Coast, get the support they need. Please heed the warnings from authorities, take steps to prepare, and stay safe. https://t.co/Jb6AYJ4o0Q",Joe Biden,Fri Jul 31 22:01:00 +0000 2020,Tweet,,,
"Together, we're going to make sure the future is made in America — by all of America. https://t.co/HX4zat4BVK",Joe Biden,Fri Jul 31 20:46:00 +0000 2020,Tweet,,,
